{
  "$schema": "http://json-schema.org/draft-07/schema#",
  "type": "array",
  "items": {
    "type": "object",
    "required": ["id", "title", "author", "downloadURL", "projectURL", "version", "minManagerVersion", "amongUsVersion"],
    "additionalProperties": false,
    "properties": {
      "id": {
        "type": "string"
      },
      "title": {
        "type": "string"
      },
      "author": {
        "type": "string"
      },
      "downloadURL": {
        "type": "string"
      },
      "projectURL": {
        "type": "string"
      },
      "version": {
        "type": "string"
      },
      "minManagerVersion": {
        "type": "string"
      },
      "amongUsVersion": {
        "type": "string"
      }
    }
  }
}
