[
  {
    "id": "the-other-roles",
    "title": "The Other Roles",
    "author": "Eisbison",
    "downloadURL": "https://github.com/Eisbison/TheOtherRoles/releases/download/v3.4.3/TheOtherRoles.zip",
    "version": "3.4.3",
    "projectURL": "https://github.com/Eisbison/TheOtherRoles",
    "minManagerVersion": "1.3.0",
    "amongUsVersion": "2021.12.15"
  },
  {
    "id": "town-of-impostors",
    "title": "Town of Impostors",
    "author": "AJMix",
    "downloadURL": "https://github.com/Town-of-Impostors/TownOfImpostors/releases/download/v2.0.8/TownOfImpostors2.0.8.zip",
    "version": "2.0.8",
    "projectURL": "https://github.com/Town-of-Impostors/TownOfImpostors",
    "minManagerVersion": "1.3.0",
    "amongUsVersion": "2021.6.15"
  }
]
